{
  "$schema": "https://json-schema.org/draft/2020-12/schema",
  "$id": "https://tessera.wm/schemas/v1/event.json",
  "title": "TesseraProtocolEvent",
  "type": "object",
  "required": [
    "protocol",
    "majorVersion",
    "minorVersion",
    "kind",
    "id",
    "event"
  ],
  "properties": {
    "protocol": {
      "type": "string",
      "const": "tessera.ipc"
    },
    "majorVersion": {
      "type": "integer",
      "const": 1
    },
    "minorVersion": {
      "type": "integer",
      "minimum": 0
    },
    "kind": {
      "type": "string",
      "const": "event"
    },
    "id": {
      "type": "string",
      "minLength": 1
    },
    "event": {
      "type": "string",
      "enum": [
        "runtime.ready",
        "runtime.stateChanged",
        "runtime.transactionCommitted",
        "runtime.configurationChanged",
        "runtime.capabilitiesChanged",
        "runtime.warning"
      ]
    },
    "data": {},
    "metadata": {
      "type": "object"
    }
  },
  "additionalProperties": false
}
